result #,search engine,query,article title,article url,article description,total nr of results (best guess),,,
0,bing,Donald Trump,Donald J. Trump - Official Site,https://www.donaldjtrump.com/,Help continue our promise to Make America Great Again!,81900000,,,
1,bing,Donald Trump,Donald Trump - Wikipedia,https://en.wikipedia.org/wiki/Donald_Trump,Donald John Trump (born June 14,,,,
2,bing,Donald Trump,Donald J. Trump | The White House,https://www.whitehouse.gov/people/donald-j-trump/,Donald J. Trump is the 45th President of the United States. He believes the United States has incredible potential and will go on to exceed even its remarkable achievements of the past. His...,81900000,,,
3,bing,Donald Trump,Donald Trump | Fox News,https://www.foxnews.com/category/person/donald-trump,"Donald Trump became the 45th president of the United States in January 2017. The real estate mogul and reality television star is the richest president in the nation""s history.",81900000,,,
4,bing,Donald Trump,Donald J. Trump - Home | Facebook,https://www.facebook.com/DonaldTrump,Donald J. Trump,,,,
5,bing,Donald Trump,Donald Trump | US news | The Guardian,https://www.theguardian.com/us-news/donaldtrump,The latest news,,,,
6,bing,Donald Trump,Donald Trump - The New York Times,https://www.nytimes.com/topic/person/donald-trump,Oct-06,,,,
7,bing,Donald Trump,Donald Trump - HISTORY,https://www.history.com/topics/us-presidents/donald-trump,,81900000,,,
8,bing,Donald Trump,Donald Trump News – the latest from Al Jazeera,https://www.aljazeera.com/topics/people/donald-trump.html,Oct-05,,,,
9,bing,Donald Trump,Donald J. Trump - Official Site,https://www.donaldjtrump.com/,Help continue our promise to Make America Great Again!,81900000,,,
10,bing,Donald Trump,Donald Trump | Fox News,https://www.foxnews.com/category/person/donald-trump,"Donald Trump became the 45th president of the United States in January 2017. The real estate mogul and reality television star is the richest president in the nation""s history.",81900000,,,
11,bing,Donald Trump,Donald Trump news,,,,,,
12,bing,Donald Trump,Donald Trump | US news | The Guardian,https://www.theguardian.com/us-news/donaldtrump,The latest news,,,,
13,bing,Donald Trump,Donald J. Trump - Home | Facebook,https://www.facebook.com/DonaldTrump,Donald J. Trump,,,,
14,bing,Donald Trump,Donald Trump - Latest News and Top Stories - NBC News,https://www.nbcnews.com/politics/donald-trump,Democrats talk op-ed asking for Trump’s Ukraine conversation to be investigated: ‘This is a game changer’,81900000,,,
15,bing,Donald Trump,Donald John Trump | TheHill,https://thehill.com/people/donald-trump,President of the United States,,,,
16,bing,Donald Trump,Donald Trump - latest news,,,,,,
17,bing,Donald Trump,Donald Trump - HISTORY,https://www.history.com/topics/us-presidents/donald-trump,Mar-07,,,,
18,bing,Donald Trump,Donald J. Trump (@realDonaldTrump) on Twitter,https://mobile.twitter.com/realDonaldTrump/tweets,As I have stated strongly before,,,,
19,bing,Donald Trump,Rallies | Donald J. Trump for President,https://www.donaldjtrump.com/rallies/,Help continue our promise to Make America Great Again!,81900000,,,
20,bing,Donald Trump,Donald Trump Jr. (@DonaldJTrumpJr) | Twitter,https://twitter.com/donaldjtrumpjr,Mar-08,,,,
21,bing,Donald Trump,Official Trump Store | Brand New Merchandise – Trump Make ...,https://shop.donaldjtrump.com/,The official Donald J. Trump Store has released a variety of brand new merchandise perfect for you and your MAGA-loving friends!,81900000,,,
22,bing,Donald Trump,Donald Trump - U.S. Presidency,,,,,,
23,bing,Donald Trump,Donald J. Trump - Official Site,https://www.donaldjtrump.com/,Help continue our promise to Make America Great Again!,81900000,,,
24,bing,Donald Trump,"President Donald J. Trump""s Accomplishments List | MAGA PILL",http://www.magapill.com/,"President Donald J. Trump""s accomplishments list. Importance of Archiving President Trump""s accomplishments: The mainstream media has completely ignored President Trump""s accomplishments and all of the positive things he has achieved while in office.",81900000,,,
25,bing,Donald Trump,Hats – Trump Make America Great Again Committee,https://shop.donaldjtrump.com/collections/headwear,The official Donald J. Trump Store has released a variety of brand new merchandise perfect for you and your MAGA-loving friends!,81900000,,,
26,bing,Donald Trump,Donald Trump | US News,https://www.usnews.com/topics/people/donald_trump,Oct-04,,,,
27,bing,Donald Trump,Donald Trump - Vox,https://www.vox.com/donald-trump,Donald Trump. Coverage of the 45th president of the United States,,,,
28,bing,Donald Trump,President Donald Trump - Public Schedule Calendar | Factbase,https://factba.se/topic/calendar,"Donald Trump - President""s Public Schedule. Available as a Google Calendar Schedule updates at midnight Eastern Time",,,,
29,bing,Donald Trump,Donald Trump - BBC News,https://www.bbc.com/news/topics/cp7r8vgl2lgt/donald-trump,"Donald Trump. Posted at 16:15. Trump loses court case to keep tax returns secret. The judge says he cannot allow a ""categorical and limitless assertion of presidential immunity"". Read more.",81900000,,,
30,bing,Donald Trump,Donald J Trump Podcast,https://trump.podbean.com/,Learn of the many accomplishments of President Trump that often go unreported by the Fake News Media as he continues to Make America Great Again.,81900000,,,
31,bing,Donald Trump,"Donald Trump""s Success Story - Investopedia",https://www.investopedia.com/updates/donald-trump-success-story/,Jul-07,,,,
32,bing,Donald Trump,Here Are 13 Examples Of Donald Trump Being Racist,https://www.huffpost.com/entry/donald-trump-racist-examples_n_56d47177e4b03260bf777e83,Republican presidential front-runner Donald Trump may have failed to disavow the Ku Klux Klan in late February,,,,
33,bing,Donald Trump,Donald Trump – Wikipédia,https://hu.wikipedia.org/wiki/Donald_Trump,Donald John Trump (New York,,,,
34,bing,Donald Trump,Donald J Trump - YouTube,https://www.youtube.com/DonaldTrump,This is the official YouTube Channel for Donald J. Trump.,81900000,,,
35,bing,Donald Trump,"What is Donald Trump""s IQ? - Quora",https://www.quora.com/What-is-Donald-Trumps-IQ,May-28,,,,
36,bing,Donald Trump,Donald Trump | South China Morning Post,https://www.scmp.com/topics/donald-trump,Latest news on Donald Trump,,,,
37,bing,Donald Trump,Lawsuit Charges Donald Trump with Raping a 13-Year-Old Girl,https://www.snopes.com/news/2016/06/23/donald-trump-rape-lawsuit/,Jun-23,,,,
38,bing,Donald Trump,A Psychologist Analyzes Donald Trump’s Personality - The ...,https://www.theatlantic.com/magazine/archive/2016/06/the-mind-of-donald-trump/480771/,In 2006,,,,
39,bing,Donald Trump,Donald Trump: Latest News,,,,,,
40,bing,Donald Trump,Donald Trump Business Bankruptcies - List and Reasons,https://www.thoughtco.com/donald-trump-business-bankruptcies-4152019,The Plaza Casino was one of two Trump casinos in Atlantic City to enter bankruptcy in March 1992. The other was the Castle Hotel &amp; Casino. The 39-story,,,,
41,bing,Donald Trump,Amazon.com: Donald Trump,https://www.amazon.com/Donald-Trump/s?k=Donald+Trump,President Predicto - Donald Trump Fortune Teller Ball - The Greatest Way to Discover Your Future - Ask a YES or NO Question &amp; Trump Speaks the Answer - Like a Next Generation Magic 8 Ball – Funny Gift,81900000,,,
42,bing,Donald Trump,Donald Trump Biography - Facts,,,,,,
43,bing,Donald Trump,Donald Trump: Latest News,,,,,,
44,bing,Donald Trump,Donald Trump - Biography - IMDb,https://www.imdb.com/name/nm0874339/bio,Donald John Trump was born on June 14,,,,
45,bing,Donald Trump,Donald Trump | PEOPLE.com,https://people.com/tag/donald-trump/,Trump Again Attacks Teenage Climate Activist Greta Thunberg,,,,
46,bing,Donald Trump,Donald Trump Quotes - BrainyQuote,https://www.brainyquote.com/authors/donald-trump-quotes,Enjoy the best Donald Trump Quotes at BrainyQuote. Quotations by Donald Trump,,,,
47,bing,Donald Trump,Donald Trump | News,,,,,,
48,bing,Donald Trump,Donald Trump - Ballotpedia,https://ballotpedia.org/Donald_Trump,Donald Trump is the 45th and current president of the United States. He assumed office on January 20,,,,
49,bing,Donald Trump,Donald Trump – Wikipedia,https://fi.wikipedia.org/wiki/Donald_Trump,Donald John Trump (s.14. kesäkuuta 1946 Queens,,,,
50,bing,Donald Trump,Donald Trump – Wikipedia,https://sv.wikipedia.org/wiki/Donald_Trump,Donald Trumps farföräldrar föddes i Kallstadt i Tyskland.Farfadern Friedrich hade förenklat släktnamnet Drumpf till Trump,,,,
51,bing,Donald Trump,"Is This Donald Trump""s Intelligence Quotient?",https://www.snopes.com/fact-check/donald-trumps-intelligence-quotient/,Dec-07,,,,
52,bing,Donald Trump,Donald Trump News | Photos | Quotes | Wiki - UPI.com,https://www.upi.com/topic/Donald_Trump/,Donald John Trump,,,,
53,bing,Donald Trump,Donald Trump Tickets,,,, tonight, this weekend," summer""	81900000"
54,bing,Donald Trump,"Donald Trump""s file | PolitiFact",https://www.politifact.com/personalities/donald-trump/,Donald Trump is the president of the United States. He was elected the 45th president of the United States on Nov. 8,,,,
55,bing,Donald Trump,Donald Trump - mashable.com,https://mashable.com/category/donald-trump/,Sep-26,,,,
56,bing,Donald Trump,Trump: The Art of the Deal: Donald J. Trump,,,,,,
57,bing,Donald Trump,Donald Trump Archives - Us Weekly - usmagazine.com,https://www.usmagazine.com/celebrities/donald-trump/,Businessman Donald Trump was born June 14,,,,
58,bing,Donald Trump,Donald Trump Articles - Breitbart,https://www.breitbart.com/tag/donald-trump/,Oct-06,,,,
59,bing,Donald Trump,Donald Trump | Yahoo Entertainment,https://www.yahoo.com/entertainment/tagged/donald-trump/,Jim Carrey Compares Trump to Hans Gruber in ‘Die Hard’-Inspired Artwork. Jim Carrey’s ready for the impeachment inquiry into Donald Trump.Sharing another one of his political satires on ...,81900000,,,
60,bing,Donald Trump,Donald Trump – Wikipedie,https://cs.wikipedia.org/wiki/Donald_Trump,—Donald Trump,,,,
61,bing,Donald Trump,Donald Trump Jr. - Biography,https://www.biography.com/personality/donald-trump-jr,Jul-10,,,,
62,bing,Donald Trump,Donald Trump Games - Free Online Donald Trump Games,https://www.crazygames.com/t/donald-trump,We collected 33 of the best free online donald trump games. These games include browser games for both your computer and mobile devices,,,,
63,bing,Donald Trump,Donald Trump | Yahoo Lifestyle,https://www.yahoo.com/lifestyle/tagged/donald-trump/,Trump-supporting Ms. Nevada claims she was stripped of title because of her conservative views. The winner of Ms. Nevada 2019,,,,
64,bing,Donald Trump,Donald Trump - apnews.com,https://apnews.com/DonaldTrump,Oct-07,,,,
65,bing,Donald Trump,"Barron Trump Facts - Melania Trump""s Son""s Age",,,,,,
66,bing,Donald Trump,Hive: Donald Trump News,,,,,,
67,bing,Donald Trump,Donald Trump on the Issues,https://www.ontheissues.org/donald_trump.htm,Donald Trump on Abortion : Click here for 22 full quotes on Abortion OR other candidates on Abortion OR background on Abortion.. FactCheck: Late abortions only for non-viable fetus. (Feb 2019) Cherish innocent life instead of ripping babies from womb.,81900000,,,
68,bing,Donald Trump,Who is Donald Trump? Bio,,,,,,
69,bing,Donald Trump,All False statements involving Donald Trump | PolitiFact,https://www.politifact.com/personalities/donald-trump/statements/byruling/false/,"Says U.S. Sen. Sherrod Brown and Dayton Mayor Nan Whaley were ""totally misrepresenting what took place inside of the hospital. Their news conference after I left for El Paso was a fraud.",81900000,,,
70,bing,Donald Trump,Donald Trump,https://www.newsmax.com/hottopics/topic/Donald-Trump/138/,Oct-06,,,,
71,bing,Donald Trump,Republican President Donald Trump - News,,,,,,
72,bing,Donald Trump,Donald J. Trump - Official Site,https://www.donaldjtrump.com/,Help continue our promise to Make America Great Again!,81900000,,,
73,bing,Donald Trump,Donald Trump presidential campaign,,,, on immigration, on foreign affairs," will be made to benefit American workers and American families.""	81900000"
74,bing,Donald Trump,How Donald Trump Got His Money,https://www.investopedia.com/updates/donald-trump-rich/,President Donald J. Trump,,,,
75,bing,Donald Trump,Presidential Election Results: Donald J. Trump Wins ...,https://www.nytimes.com/elections/2016/results/president,Aug-09,,,,
76,bing,Donald Trump,Donald Trump Stories - washingtonexaminer.com,https://www.washingtonexaminer.com/tag/donald-trump,"Donald Trump Stories ... Trump-district Democrat echoes Nancy Pelosi ""sad"" words about impeachment. Kerry Picket | October 02",,,,
77,bing,Donald Trump,Donald Trump List of Movies and TV Shows | TV Guide,https://www.tvguide.com/celebrities/donald-trump/credits/194141/,Donald Trump full list of movies and tv shows in theaters,,,,
78,bing,Donald Trump,Donald Trump GIFs - Find & Share on GIPHY,https://giphy.com/search/donald-trump/,Find GIFs with the latest and newest hashtags! Search,,,,
79,bing,Donald Trump,"World""s Best Donald Trump Stock Pictures",,,,,,
80,bing,Donald Trump,Donald Trump on Immigration: Pros,,,,,,
81,bing,Donald Trump,Who Is Kimberly Guilfoyle,,,,,,
82,bing,Donald Trump,Does Donald Trump Have a College Degree ...,https://www.urbanedjournal.org/degree/does-donald-trump-have-college-degree,Many US citizens and other people around the world interested in question: Does Donald Trump Have a College Degree? Trump grew up in Jamaica,,,,
83,bing,Donald Trump,Donald J. Trump | C-SPAN.org,https://www.c-span.org/person/?donaldtrump,Donald J. Trump. Donald John Trump is the 45th and current President of the United States,,,,
84,bing,Donald Trump,"President Donald Trump""s Economic Plan - The Balance",https://www.thebalance.com/donald-trump-economic-plan-3994106,Jul-11,,,,
85,bing,Donald Trump,Donald Trump - Wikimedia Commons,https://commons.wikimedia.org/wiki/Donald_Trump,This page was last edited on 7 March 2019,,,,
86,bing,Donald Trump,The Many Scandals of Donald Trump: A Cheat Sheet,https://www.theatlantic.com/politics/archive/2017/01/donald-trump-scandals/474726/,Jan-23,,,,
87,bing,Donald Trump,3 Ways to Meet Donald Trump - wikiHow,https://www.wikihow.com/Meet-Donald-Trump,Jul-25,,,,
88,bing,Donald Trump,"Donald Trump""s Border Wall: A ""Progress"" Report",https://www.nbcnews.com/politics/donald-trump/donald-trump-s-border-wall-progress-report-n764726,May-30,,,,
89,bing,Donald Trump,Live President Donald Trump Popularity Polls – Live Latest ...,http://www.donaldjtrumppolls.com/,Keep up to date on President Trump’s popularity and how the general population perceives his performance. All polling records shown on this website are 100% accurate and reveal the …,81900000,,,
90,bing,Donald Trump,Trump must be impeached. Here’s why.,https://www.washingtonpost.com/opinions/trump-must-be-impeached-heres-why/2017/05/13/82ce2ea4-374d-11e7-b4ee-434b6d506b37_story.html,Scenes from the Republican’s beginning months in the White House. Jan. 25,,,,
91,bing,Donald Trump,Biography of President Donald Trump for Kids,https://www.ducksters.com/biography/uspresidents/donaldtrump.php,Donald Trump is a businessman who became the 45th president of the United States. Kids learn about his biography and life story.,81900000,,,
92,bing,Donald Trump,Donald Trump | Yahoo News - Latest News & Headlines,https://news.yahoo.com/tagged/donald-trump/,"Trump thinks it""s fine to sic Ukraine and China on Biden. Here are some of the problems with that. FEC Chair Ellen Weintraub clarifies the principle behind campaign finance laws outlawing foreign election help.",81900000,,,
93,bing,Donald Trump,Donald Trump Biography - family,,,,,,
94,bing,Donald Trump,Donald Trump | Financial Times,https://www.ft.com/donald-trump,The end of the WeWork boom rattles property markets Donald Trump clears Turkish operation in Syria against Kurds New whistleblower emerges in Trump’s Ukraine scandal,81900000,,,
95,bing,Donald Trump,Donald Trump | TheHill,https://thehill.com/person/donald-trump,The Hill is a top US political website,,,,
96,bing,Donald Trump,Donald Trump GIFs - Get the best GIF on GIPHY,https://giphy.com/explore/donald-trump,Explore and share the best Donald Trump GIFs and most popular animated GIFs here on GIPHY. Find Funny GIFs,,,,
97,bing,Donald Trump,Donald Trump - Haaretz Com,https://www.haaretz.com/misc/tags/TAG-donald-trump-1.5599319,Donald Trump is the president of the United States.. Trump was born in New York on June 14,,,,
98,bing,Donald Trump,Donald Trump (US President) - Bio,,,," and more.""	81900000",,
99,bing,Donald Trump,Donald Trump - BBC News,https://www.bbc.co.uk/news/topics/cp7r8vgl2lgt/donald-trump,Donald Trump. Posted at 1:30. Trump might not get his wall. It might not matter. Thom Poole. BBC News. It might not be big,,,,
