result #,search engine,query,article title,article url,article description,total nr of results (best guess),,,
0,bing,Greta Thunberg,Greta Thunberg - Wikipedia,https://en.wikipedia.org/wiki/Greta_Thunberg,,7790000,,,
1,bing,Greta Thunberg,Greta Thunberg (@gretathunberg) • Instagram photos and videos,https://www.instagram.com/gretathunberg/,,7790000,,,
2,bing,Greta Thunberg,Greta Thunberg - Home | Facebook,https://www.facebook.com/gretathunbergsweden/,Greta Thunberg 23 hrs · ‪The last two days Tokata Iron Eyes and I visited Takini School,,,,
3,bing,Greta Thunberg,Greta Thunberg Age,,,," Svante Thunberg…""	7790000",,
4,bing,Greta Thunberg,Greta Thunberg - IMDb,https://www.imdb.com/name/nm10361418/,Greta Thunberg was born on January 3,,,,
5,bing,Greta Thunberg,Greta Thunberg | Speaker | TED,https://www.ted.com/speakers/greta_thunberg,Mar-11,,,,
6,bing,Greta Thunberg,Greta Thunberg: 5 Fast Facts You Need to Know | Heavy.com,https://heavy.com/news/2018/12/greta-thunberg/,Greta Thunberg is a Swedish climate activist. In Poland last week at the COP24 climate talks,,,,
7,bing,Greta Thunberg,Greta Thunberg,,,,,,
8,bing,Greta Thunberg,Greta Thunberg full speech at UN Climate Change COP24 ...,https://www.youtube.com/watch?v=VFkQSGyeCWg,Dec-15,,,,
9,bing,Greta Thunberg,Greta Thunberg Age,,,,,,
10,bing,Greta Thunberg,Greta Thunberg - Simple English Wikipedia,,,,,,
11,bing,Greta Thunberg,Greta Thunberg - IMDb,https://www.imdb.com/name/nm10361418/,Greta Thunberg was born on January 3,,,,
12,bing,Greta Thunberg,Greta Thunberg faces a storm of criticism in her sailing ...,https://www.washingtonpost.com/world/2019/08/15/swedish-climate-activist-greta-thunberg-is-sailing-america-amid-storm-criticism/,— Greta Thunberg (@GretaThunberg) August 14,,,,
13,bing,Greta Thunberg,Greta Thunberg - Wikiquote,https://en.wikiquote.org/wiki/Greta_Thunberg,Greta Thunberg (born 3 January 2003) is a Swedish climate activist. In August 2018,,,,
14,bing,Greta Thunberg,Greta Thunberg Quotes,https://www.quotes.net/authors/Greta+Thunberg,Greta Thunberg. Greta Thunberg (born 3 January 2003) is a Swedish climate activist. She is known for striking outside the Swedish parliament building to raise climate change activism. Update this biography » Complete biography of Greta Thunberg »,7790000,,,
15,bing,Greta Thunberg,25 of Greta Thunberg’s Best Quotes - Climate Change,https://www.curious.earth/blog/greta-thunberg-quotes-best-21,Greta Thunberg is a 16-year old climate activist from Sweden. A school girl with autism,,,,
16,bing,Greta Thunberg,This Greta Thunberg thing is child abuse,https://www.washingtonexaminer.com/opinion/this-greta-thunberg-thing-is-child-abuse,Aug-29,,,,
17,bing,Greta Thunberg,The problem with Greta Thunberg’s sea crossings ...,https://spectator.us/problem-greta-thunberg-sea-crossings/,Aug-28,,,,
18,bing,Greta Thunberg,Teen Activist Greta Thunberg on the Climate Change Fight,https://time.com/collection-post/5584902/greta-thunberg-next-generation-leaders/,May-16,,,,
19,bing,Greta Thunberg,Greta Thunberg arrives in New York after 15-day yacht ...,https://www.cnn.com/2019/08/28/us/greta-thunberg-new-york-landfall-scli-intl/index.html,Aug-28,,,,
20,bing,Greta Thunberg,Greta Thunberg: The disarming case to act right now on ...,https://www.ted.com/talks/greta_thunberg_the_disarming_case_to_act_right_now_on_climate,In this passionate call to action,,,,
21,bing,Greta Thunberg,Greta Thunberg Arrives in New York After Sailing Across ...,https://time.com/5663534/greta-thunberg-arrives-sail-atlantic/,Aug-28,,,,
22,bing,Greta Thunberg,The Manufacturing of Greta Thunberg - for Consent: The ...,http://www.wrongkindofgreen.org/2019/01/17/the-manufacturing-of-greta-thunberg-for-consent-the-political-economy-of-the-non-profit-industrial-complex/,— Greta Thunberg,,,,
23,bing,Greta Thunberg,"How Greta Thunberg""s rise could backfire on environmentalists",https://www.cnbc.com/2019/09/24/how-greta-thunbergs-rise-could-backfire-on-environmentalists.html,Sep-24,,,,
24,bing,Greta Thunberg,Greta Thunberg Articles - Breitbart,https://www.breitbart.com/tag/greta-thunberg/,Greta Thunberg joined a large crowd of young people skipping school in Iowa City,,,,
25,bing,Greta Thunberg,Why Greta Thunberg can capture our attention on climate.,https://slate.com/technology/2019/09/greta-thunberg-climate-activism-scares-the-right-and-the-left.html,Swedish climate activist Greta Thunberg poses for a photograph on board the Malizia II sailing yacht in Plymouth,,,,
26,bing,Greta Thunberg,Who is Greta Thunberg? — Steemit,https://steemit.com/gretathunberg/@kiligirl/who-is-greta-thunberg,Greta Thunberg; born 3 January 2003) is a Swedish climate activist. In August 2018,,,,
27,bing,Greta Thunberg,Who is Greta Thunberg and what does she have to say?,https://iknowwaste.com/greta-thunberg-climate-change-strike/,Dec-05,,,,
28,bing,Greta Thunberg,8 Things You Need To Know About Greta Thunberg,,,,,,
29,bing,Greta Thunberg,Greta Thunberg is an embarrassment to all the jet-setting ...,https://nypost.com/2019/08/30/greta-thunberg-is-an-embarrassment-to-all-the-jet-setting-climate-activists/,We’re not huge fans of Greta Thunberg’s message,,,,
30,bing,Greta Thunberg,Opinion | The Problem With Greta Thunberg’s Climate ...,https://www.nytimes.com/2019/08/02/opinion/climate-change-greta-thunberg.html,Aug-02,,,,
31,bing,Greta Thunberg,Quote of the Week: Greta Thunberg claims to be able to ...,https://wattsupwiththat.com/2019/05/02/quote-of-the-week-greta-thunberg-claims-to-be-able-to-see-carbon-dioxide-in-the-air/,May-02,,,,
32,bing,Greta Thunberg,Greta Thunberg – Wikipédia,,,,,,
33,bing,Greta Thunberg,"How green is Greta Thunberg""s transatlantic trip? | UK ...",https://news.sky.com/story/greta-thunberg-is-her-transatlantic-trip-really-that-green-11784480,Aug-14,,,,
34,bing,Greta Thunberg,"""How Dare You!"": Greta Thunberg Rages at ""Fairytales of ...",https://www.commondreams.org/news/2019/09/23/how-dare-you-greta-thunberg-rages-fairytales-eternal-economic-growth-un-climate,Sep-23,,,,
35,bing,Greta Thunberg,Greta Thunberg Gifts & Merchandise | Redbubble,https://www.redbubble.com/shop/greta+thunberg,High quality Greta Thunberg inspired T-Shirts,,,,
36,bing,Greta Thunberg,Greta Thunberg,,,,,,
37,bing,Greta Thunberg,Teen climate crusader Greta Thunberg completes carbon-free ...,https://www.foxnews.com/science/teen-climate-crusader-greta-thunberg-completes-carbon-free-voyage-by-yacht-from-europe-to-new-york-city,"Teenage climate activist Greta Thunberg arrived in New York City on Wenesday after a 15-day trip by yacht from England. ""The trip was surprisingly good; I did not feel seasick once",,,,
38,bing,Greta Thunberg,Greta Thunberg T-Shirts | Redbubble,https://www.redbubble.com/shop/greta+thunberg+t-shirts,High quality Greta Thunberg inspired T-Shirts by independent artists and designers from around the world.All orders are custom made and most ship worldwide within 24 hours.,7790000,,,
39,bing,Greta Thunberg,Greta Thunberg to climate-focused UN: ‘You have stolen my ...,https://www.marketwatch.com/story/greta-thunberg-to-climate-focused-un-you-have-stolen-my-childhood-with-empty-words-2019-09-23,Sep-23,,,,
40,bing,Greta Thunberg,Greta Thunberg Bio,,,,2003, Greta Thunberg is a Swedish political activist who rose to fame for starting the first school strike for climate outside the Swedish parliament building. In December 2018," she addressed the United Nations Climate Change Conference and in January 2019 she was invited to talk to the World Economic Forum at Davos.""	7790000"
41,bing,Greta Thunberg,"George Soros is Backing ""Climate activist"" Greta Thunberg",https://www.bibliotecapleyades.net/ciencia3/ciencia_climatechange147.htm,Greta Thunberg is now 16-years old and the daughter of famous opera singer and left-liberal activist Marlena Ernman (above image),,,,
42,bing,Greta Thunberg,Why Greta Thunberg Makes Adults Uncomfortable - The Atlantic,https://www.theatlantic.com/science/archive/2019/09/why-greta-wins/598612/,Sep-23,,,,
43,bing,Greta Thunberg,"Greta Thunberg""s Transatlantic Sailing Trip Is Seriously ...",https://cleantechnica.com/2019/08/22/greta-thunbergs-transatlantic-sailing-trip-is-seriously-carbon-neutral/,UN Secretary-General António Guterres meets with Greta Thunberg,,,,
44,bing,Greta Thunberg,Greta Thunberg - BBC News,https://www.bbc.com/news/topics/cwmrxq94v1jt/greta-thunberg,"Vladimir Putin criticises Greta Thunberg""s UN speech on climate change Russian president Vladimir Putin said there was a need to be ""realistic"" about renewable energy.",7790000,,,
45,bing,Greta Thunberg,"Climate Activist Greta Thunberg and ""The Greta Effect""",https://interestingengineering.com/swedish-climate-activist-greta-thunberg-and-the-greta-thunberg-effect,"Swedish Climate Activist Greta Thunberg and the ""Greta Thunberg Effect"" A 16-year-old Swedish girl with braids is on Time Magazine""s cover",,,,
46,bing,Greta Thunberg,George Soros is backing Greta Thunberg | Free West Media,https://freewestmedia.com/2019/04/24/george-soros-is-backing-greta-thunberg/,Greta Thunberg is now 16-years old and the daughter of famous opera singer and left-liberal activist Marlena Ernman,,,,
47,bing,Greta Thunberg,"Why Greta Thunberg doesn""t deserve a Nobel - spiked",https://www.spiked-online.com/2019/03/22/why-greta-thunberg-doesnt-deserve-a-nobel/,Greta Thunberg – the stern 16-year-old voice and face of the recent school climate-strike movement – has been nominated for the Nobel Peace Prize. Thunberg first made headlines when she ...,7790000,,,
48,bing,Greta Thunberg,Greta Thunberg’s Slow Boat to New York | The New Yorker,https://www.newyorker.com/magazine/2019/09/09/greta-thunbergs-slow-boat-to-new-york,Greta Thunberg’s Slow Boat to New York A crowd of young eco-warriors and international media greeted the teen-age climate activist as she sailed into town on a carbon-neutral boat to attend a ...,7790000,,,
49,bing,Greta Thunberg,Who Is Greta Thunberg? 15 Inspirational Quotes From The 16 ...,https://www.yourtango.com/2019325009/who-greta-thunberg-quotes-climate-change-activist,Jun-07,,,,
50,bing,Greta Thunberg,#GretaThunberg hashtag on Twitter,https://twitter.com/hashtag/GretaThunberg,Greta Thunberg Verified account @GretaThunberg. When haters go after your looks and differences,,,,
51,bing,Greta Thunberg,"Greta Thunberg Responds To Trump""s Sarcastic Tweet With ...",https://www.huffpost.com/entry/greta-thunberg-shade-trump_n_5d8a3c03e4b0938b59350e81,Sep-24,,,,
52,bing,Greta Thunberg,Greta Thunberg is right: Autism is her superpower. Those ...,https://www.salon.com/2019/09/12/greta-thunberg-is-right-autism-is-her-superpower-those-who-mock-her-should-learn-from-her/,Sep-12,,,,
53,bing,Greta Thunberg,Surprised? Greta Thunberg’s “Coach” A Soros,,,,,,
54,bing,Greta Thunberg,If Greta Thunberg worries about end of the world,,,,,,
55,bing,Greta Thunberg,Greta Thunberg to sail to New York climate summit in ...,https://www.climatechangenews.com/2019/07/29/greta-thunberg-sail-new-york-climate-summit-racing-yacht/,Jul-29,,,,
56,bing,Greta Thunberg,Greta Thunberg,,,,,,
57,bing,Greta Thunberg,"Greta Thunberg to US Congress on climate change: ""Wake up""",https://www.aljazeera.com/news/2019/09/greta-thunberg-congress-climate-change-wake-190918234408009.html,Sep-18,,,,
58,bing,Greta Thunberg,Greta Thunberg - Inspiring Others to Take a Stand Against ...,http://www.cc.com/video-clips/ed6ma7/the-daily-show-with-trevor-noah-greta-thunberg---inspiring-others-to-take-a-stand-against-climate-change---extended-interview,Greta Thunberg - Inspiring Others to Take a Stand Against Climate Change - Extended Interview Interview 9/11/2019 Climate activist Greta Thunberg talks about her decision to no longer travel by plane and describes how a lack of understanding of climate change is impacting the planet.,7790000,,,
59,bing,Greta Thunberg,Greta Thunberg Takes Senators To Task: You’re Not Trying ...,https://www.huffpost.com/entry/greta-thunberg-senate-democrats_n_5d81992de4b0849d47200657,Sep-18,,,,
60,bing,Greta Thunberg,Stop the Exploitation of Greta Thunberg | Intellectual Takeout,https://www.intellectualtakeout.org/article/stop-exploitation-greta-thunberg,Sep-11,,,,
61,bing,Greta Thunberg,Greta Thunberg’s sailing won’t help the climate at all,https://www.washingtonexaminer.com/opinion/greta-thunbergs-sailing-wont-help-the-climate-at-all,Greta Thunberg,,,,
62,bing,Greta Thunberg,"""How dare you?"" Greta Thunberg asks world leaders at UN",http://www.msn.com/en-us/news/world/how-dare-you-greta-thunberg-asks-world-leaders-at-un/ar-AAHJbDp,Sep-23,,,,
63,bing,Greta Thunberg,Greta Thunberg,,,,,,
64,bing,Greta Thunberg,"Greta Thunberg: Stigmatized for Asperger""s - psychcentral.com",https://psychcentral.com/blog/greta-thunberg-stigmatized-for-aspergers/,Sep-26,,,,
65,bing,Greta Thunberg,COP24,,,,,,
66,bing,Greta Thunberg,Greta Thunberg and ‘Flight Shame’ Fuel a Carbon Offset ...,https://www.bloomberg.com/news/articles/2019-08-10/greta-thunberg-and-flight-shame-fuel-a-carbon-offset-boom,Aug-10,,,,
67,bing,Greta Thunberg,Fears Greta Thunberg is being manipulated on climate ...,https://www.thesun.co.uk/news/9756307/greta-thunberg-climate-change-fears-parents/,Aug-19,,,,
68,bing,Greta Thunberg,Greta Thunberg - Home | Facebook,https://www.facebook.com/gretathunbergsweden/?epa=SEARCH_BOX,Greta Thunberg. 2,,,,
69,bing,Greta Thunberg,Climate activist Greta Thunberg,,,,,,
70,bing,Greta Thunberg,Greta Thunberg - Bio,,,,,,
71,bing,Greta Thunberg,The trouble with Greta Thunberg | Coffee House,https://blogs.spectator.co.uk/2019/04/the-trouble-with-greta-thurnberg/,Apr-23,,,,
72,bing,Greta Thunberg,Greta Thunberg Story - Bio,,,,,,
73,bing,Greta Thunberg,Greta Thunberg rages at world leaders at UN climate summit ...,https://www.vox.com/2019/9/23/20879924/greta-thunberg-climate-action-summit-2019-un,Sep-23,,,,
74,bing,Greta Thunberg,Attacks on Greta Thunberg Come from a Coordinated Network ...,https://www.teenvogue.com/story/attacks-greta-thunberg-climate-deniers,Sep-23,,,,
75,bing,Greta Thunberg,Greta Thunberg submits prominent global warming report to ...,https://thehill.com/policy/energy-environment/461846-climate-activist-greta-thunberg-submits-global-warming-report-to,Climate activist Greta Thunberg on Tuesday submitted a prominent global warming report to Congress in place of prepared remarks ahead of her appearance at a House hearing.,7790000,,,
76,bing,Greta Thunberg,"Greta Thunberg""s Day At UN Features Fiery Speech",,,,,,
77,bing,Greta Thunberg,"Greta Thunberg""s Best Quotes | Eco-Age",https://eco-age.com/news/greta-thunbergs-best-quotes,In just 12 months,,,,
78,bing,Greta Thunberg,"You can track Greta Thunberg""s travels as she sails across ...",https://mashable.com/article/greta-thunberg-sail-ocean-climate/,Aug-14,,,,
79,bing,Greta Thunberg,Beata Ernman Thunberg,,,,,,
80,bing,Greta Thunberg,The Manufacturing of Greta Thunberg - wrongkindofgreen.org,http://www.wrongkindofgreen.org/2019/01/28/the-manufacturing-of-greta-thunberg-for-consent-the-most-inconvenient-truth-capitalism-is-in-danger-of-falling-apart/,Greta Thunberg’s sister,,,,
81,bing,Greta Thunberg,Greta Thunberg’s speech to UN secretary general António ...,https://medium.com/wedonthavetime/greta-thunberg-speech-to-un-secretary-general-ant%C3%B3nio-guterres-362175826548,Dec-03,,,,
82,bing,Greta Thunberg,"Cramped and basic: Greta Thunberg""s voyage to New York",https://news.yahoo.com/cramped-basic-greta-thunbergs-voyage-york-163315047.html,Aug-13,,,,
83,bing,Greta Thunberg,"Watch: Greta Thunberg""s Epic Reaction As Donald Trump ...",https://www.ndtv.com/world-news/watch-greta-thunbergs-epic-reaction-as-donald-trump-walks-past-at-un-2106078,Sep-24,,,,
84,bing,Greta Thunberg,Teen climate activist Greta Thunberg arrives in New York ...,https://abcnews.go.com/US/teen-climate-activist-greta-thunberg-arrives-york-summit/story?id=65240237,Aug-28,,,,
85,bing,Greta Thunberg,Fox News Apologizes After Panelist Calls Greta Thunberg A ...,https://dailycaller.com/2019/09/23/fox-news-apologizes-michael-knowles-greta-thunberg-mentally-ill/,Fox News issued an apology after a panelist described Swedish climate activist Greta Thunberg as “a mentally ill Swedish child.” The Monday night “The Story with Martha MacCallum” panel featured conservative podcaster Michael Knowles matched up against Democratic Party activist and frequent Fox News guest Chris Hahn.,7790000,,,
86,bing,Greta Thunberg,Greta Thunberg: How one teenager became the voice of the ...,https://www.wired.co.uk/article/greta-thunberg-climate-crisis,Jun-06,,,,
87,bing,Greta Thunberg,"Greta Thunberg: Climate activist says Asperger""s Syndrome ...",https://www.independent.co.uk/life-style/health-and-families/greta-thunberg-gift-asperger-syndrome-environment-strike-climate-change-radio-4-a8883056.html,Apr-23,,,,
88,bing,Greta Thunberg,"How teen Greta Thunberg shifted world""s gaze to climate change",https://www.nbcnews.com/news/world/how-teen-greta-thunberg-shifted-world-s-gaze-climate-change-n1043151,Aug-17,,,,
89,bing,Greta Thunberg,Greta Thunberg – Wikipedia,https://fi.wikipedia.org/wiki/Greta_Thunberg,Greta Tintin Eleonora Ernman Thunberg (s.3. tammikuuta 2003 Tukholma,,,,
90,bing,Greta Thunberg,Psychologist: Greta Thunberg needs treatment - WND,https://www.wnd.com/2019/09/psychologist-greta-thunberg-needs-treatment/,Sep-25,,,,
91,bing,Greta Thunberg,‘How Dare You!’ Greta Thunberg Rebukes World Leaders | The ...,https://www.thenation.com/article/climate-summit-greta/,Sep-23,,,,
92,bing,Greta Thunberg,The two reactions to Greta Thunberg - noqreport.com,https://noqreport.com/2019/09/23/two-reactions-greta-thunberg/,Sep-23,,,,
93,bing,Greta Thunberg,Trump’s Tweet About Greta Thunberg Is An Insult To The ...,https://www.forbes.com/sites/sarahkim/2019/09/24/trumps-tweet-greta-thunberg/,Sep-24,,,,
94,bing,Greta Thunberg,Why is Greta Thunberg treated so badly by many? - Quora,https://www.quora.com/Why-is-Greta-Thunberg-treated-so-badly-by-many,"“She refused to take a fuel-intensive plane and decided to adopt zero-carbon travel to raise people""s awareness of environmental protection” Her green sailing sailboat is worth tens of millions of dollars. In order to record her green journey",,,,
95,bing,Greta Thunberg,Greta Thunberg: Climate change activist interviewed by The ...,https://www.indy100.com/article/greta-thunberg-trevor-noah-climate-change-interview-watch-video-9106256,Sep-15,,,,
96,bing,Greta Thunberg,Greta Thunberg Is the Climate Heroine We Need,https://www.thedailybeast.com/greta-thunberg-is-the-climate-heroine-we-need,Greta Thunberg Is the Climate Heroine We Need. Greta Thunberg was dying from depression and starvation when she had a nightmare about climate change that saved her life. It might just save all of us.,7790000,,,
97,bing,Greta Thunberg,Greta Thunberg Changes Twitter Bio After Trump Troll,https://www.buzzfeednews.com/article/clarissajanlim/greta-thunberg-twitter-bio-trump,Sep-24,,,,
98,bing,Greta Thunberg,My name is Matilda Olofsson and I am Greta Thunberg’s arch ...,https://spectator.us/matilda-olofsson-greta-thunberg/,Apr-25,,,,
99,bing,Greta Thunberg,"Greta Thunberg masterfully pulls apart congressman""s ...",https://mashable.com/article/greta-thunberg-house-of-representatives-hearing/,Sep-18,,,,
